Market_Segment,Market_Size_2025,Growth_Rate_CAGR,MMTU_Addressable_Market,Revenue_Opportunity,Key_Insights
GitHub Marketplace (Security Apps),440 Apps serving 111+ customers,High growth platform,150M GitHub developers,High - proven demand,GitGuardian most installed with 418K+ developers
GitHub Developers (Total),150M+ developers,Expanding rapidly,150M GitHub developers,Very High - massive user base,Platform native apps show strong adoption
Business Intelligence Software (US),$14.64B,3.52%,SMBs + Enterprise users,Medium - established market,Custom reports $200-2000 typical pricing
Creator Economy (Global),$104.2B,22.7%,50M+ content creators,High - growing rapidly,Premium overlay packages $10-50+ range
Developer Tools Market,Part of $1.25T enterprise software,14.2%,Developer-focused subset,Medium - competitive,53% prefer subscription pricing models
Security Assessment Services,Part of security services market,Increasing demand,Security-conscious startups,Medium - specialized need,Compliance and auditing growing need